TEXT	ADJACENT?	ARGUMENTATIVE RELATION	NUMBER OF INSERTED SENTENCES	SEMANTIC CLAUSE TYPE	CN RELATION	MISSING INFORMATION 1	SEMANTIC CLAUSE TYPE 1	CN RELATIONS 1	MISSING INFORMATION 2	SEMANTIC CLAUSE TYPE 2	CN RELATIONS 2	MISSING INFORMATION 3	SEMANTIC CLAUSE TYPE 3	CN RELATIONS 3	MISSING INFORMATION 4	SEMANTIC CLAUSE TYPE 4	CN RELATIONS 4	MISSING INFORMATION 5	SEMANTIC CLAUSE TYPE 5	CN RELATIONS 5
e1: I find the peripheral housing development at Tempelhofer Feld right for urban planning reasons,				ABSTRACT ENTITY/STATE	peripheral housing develompent, urban planning (PartOf)/peripheral housing development, Tempelhofer Feld (AtLocation)/peripheral housing development at Tempelhofer Feld, right (HasProperty)/peripheral housing development, urban planning reasons (MotivatedByGoal)/urban planning reasons, peripheral housing development at Tempelhofer Feld (Causes)/Tempelhofer Feld, peripheral housing development (HasA)															
e2: as the area is right in the middle of the city (capital).				STATE	area, middle of the city (AtLocation)/capital, city (IsA)															
e3: The size of the field allows for both housing and generous open space.				STATE	field, housing (CapableOf)/size of the field, housing (UsedFor)/size of the field, open space (UsedFor)															
e2-e1	adjacent	sup	2			The Tempelhofer Feld is a large area.	STATE	Tempelhofer Feld, area (IsA)/Tempelhofer Feld, large (HasProperty)/area, large (HasProperty)	It makes sense to use a large area for peripheral housing development.	GENERIC	large area, peripheral housing development (UsedFor)/peripheral housing development, large area (AtLocation)									
e3-e1	not adjacent	sup	2			For urban planning reasons it is right to use large areas.	STATE	large areas, urban planning (UsedFor)	The Tempelhofer Feld is a large area.	STATE	Tempelhofer Feld, area (IsA)/Tempelhofer Feld, large (HasProperty)									
e2-e3	adjacent	NONE	3			The area is a large field in the middle of the city.	STATE	area, large field (IsA)/large field, middle of the city (AtLocation)/area, middle of the city (AtLocation)	A large field can be used for housing.	GENERIC	large field, used for housing (ReceivesAction)/large field, housing (UsedFor)	When something is in the middle of the city, it is suitable for housing.	GENERIC/GENERIC	something in the middle of the city, something suitable for housing (IsA)/middle of the city, housing (UsedFor)/middle of the city, suitable for housing (HasProperty)/housing, middle of the city (AtLocation)						
